{
  "schema": "mobilebuildmcp.output.app-path",
  "schemaVersion": "2",
  "didError": false,
  "error": null,
  "data": {
    "summary": {
      "status": "SUCCEEDED",
      "target": "macos"
    },
    "artifacts": {
      "appPath": "<TMPDIR>/DerivedData/Build/Products/Debug/MCPTest.app"
    }
  },
  "nextSteps": [
    "Get bundle ID: get_mac_bundle_id({ appPath: \"<TMPDIR>/DerivedData/Build/Products/Debug/MCPTest.app\" })",
    "Launch app: launch_mac_app({ appPath: \"<TMPDIR>/DerivedData/Build/Products/Debug/MCPTest.app\" })"
  ]
}
