{
  "schema": "mobilebuildmcp.output.app-path",
  "schemaVersion": "2",
  "didError": false,
  "error": null,
  "data": {
    "request": {
      "scheme": "CalculatorApp",
      "workspacePath": "example_projects/iOS_Calculator/CalculatorApp.xcworkspace",
      "platform": "iOS"
    },
    "summary": {
      "status": "SUCCEEDED",
      "target": "device"
    },
    "artifacts": {
      "appPath": "<TMPDIR>/Build/Products/Debug-iphoneos/CalculatorApp.app"
    }
  },
  "nextSteps": [
    "Get bundle ID: mobilebuildmcp device get-app-bundle-id --app-path <TMPDIR>/Build/Products/Debug-iphoneos/CalculatorApp.app",
    "Install app on device: mobilebuildmcp device install --device-id DEVICE_UDID --app-path <TMPDIR>/Build/Products/Debug-iphoneos/CalculatorApp.app",
    "Launch app on device: mobilebuildmcp device launch --device-id DEVICE_UDID --bundle-id BUNDLE_ID"
  ]
}
